"393",33104811,1257864852992782336,"2020/05/06 02:48:45","Phxflyer","Here at @GioninosO we’re serving up pasta, pizza and COVID-19 with an extra large portion of stupidity! #TrumpVirus #coronavirus https://t.co/seHe8n9bPO","Twitter for iPad",128,NA,NA,NA,TRUE,FALSE,1,0,NA,NA,"TrumpVirus, coronavirus",NA,"twitter.com/aetiology/stat…","https://t.co/seHe8n9bPO","https://twitter.com/aetiology/status/1257695478512332800",NA,NA,NA,NA,NA,NA,NA,NA,"478860896","GioninosO","en",1257695478512332800,"Orville, Ohio. Not sure if this is chain-wide. @GioninosO https://t.co/jatvgCWGr9","2020/05/05 15:35:43","Twitter for Android",3130,1389,35315865,"aetiology","Dr. Tara C. Smith",68262,4624,32326,"Kent, Ohio","Professor, infectious disease epidemiologist, writer, K & teen wrangler. Antibiotic resistance, zoonotic disease, scicomm, zombies. She/her. No one's sweetie.",TRUE,NA,NA,NA,NA,NA,NA,NA,NA,NA,NA,NA,NA,NA,NA,NA,NA,NA,NA,NA,NA,NA,NA,NA,NA,"https://twitter.com/Phxflyer/status/1257864852992782336","Bad Hombre Jim Says Wash Your Hands ✊🏼🦅🇮🇪","Phoenix, AZ","Have you ever noticed you never see me and Batman at the same time? Sent from my toaster oven while watching Philly sports. Philly ➡️ AZ. I need a cheesesteak.",NA,FALSE,1221,1084,64,140164,125757,"2009/04/19 02:48:08",FALSE,NA,NA,NA,"https://pbs.twimg.com/profile_banners/33104811/1576513878","http://abs.twimg.com/images/themes/theme14/bg.gif","http://pbs.twimg.com/profile_images/792459179734609920/JgTny_D7_normal.jpg"
"394",884843782763495424,1257864674726391808,"2020/05/06 02:48:03","WendyGo47405331","@JDiamond1 @gtconway3d That makes sense, since they are definitely not interested in doing their actual jobs, just interested in money and coronavirus is getting in the way.","Twitter Web App",150,1257805443545608192,407396556,"JDiamond1",FALSE,FALSE,0,0,NA,NA,NA,NA,NA,NA,NA,NA,NA,NA,NA,NA,NA,NA,NA,"407396556, 471677441","JDiamond1, gtconway3d","en",NA,NA,NA,NA,NA,NA,NA,NA,NA,NA,NA,NA,NA,NA,NA,NA,NA,NA,NA,NA,NA,NA,NA,NA,NA,NA,NA,NA,NA,NA,NA,NA,NA,NA,NA,NA,NA,NA,NA,"https://twitter.com/WendyGo47405331/status/1257864674726391808","Wendy Goodman","Tucson, AZ",NA,NA,FALSE,30,94,0,1907,4211,"2017/07/11 18:36:12",FALSE,NA,NA,NA,NA,NA,"http://pbs.twimg.com/profile_images/884874542530699264/D9Xbi5rV_normal.jpg"
"395",330771231,1257864622050177024,"2020/05/06 02:47:50","AZTanya","^Federal officials who had spent years devising emergency plans were layered over by Kushner allies, working with and within the White House coronavirus task force, who believed their private-sector experience could solve the country’s looming supply shortage.","Twitter Web App",260,1257864159120592896,330771231,"AZTanya",FALSE,FALSE,0,0,NA,NA,NA,NA,NA,NA,NA,NA,NA,NA,NA,NA,NA,NA,NA,NA,NA,"en",NA,NA,NA,NA,NA,NA,NA,NA,NA,NA,NA,NA,NA,NA,NA,NA,NA,NA,NA,NA,NA,NA,NA,NA,NA,NA,NA,NA,NA,NA,NA,NA,NA,NA,NA,NA,NA,NA,NA,"https://twitter.com/AZTanya/status/1257864622050177024","Wash your hands and breathe the other way, please.","Phoenix, AZ","Underpinning philosophy of my life:. Try not to be too much of an asshole. 

try. it.",NA,FALSE,1699,1793,109,302689,19419,"2011/07/07 03:54:40",FALSE,NA,NA,NA,"https://pbs.twimg.com/profile_banners/330771231/1555180328","http://abs.twimg.com/images/themes/theme1/bg.png","http://pbs.twimg.com/profile_images/1097226455820292097/AO__QrP__normal.png"
"396",330771231,1257863924776488960,"2020/05/06 02:45:04","AZTanya","How Kushner’s Volunteer Force Led a Fumbling Hunt for Medical Supplies - The New York Times
https://t.co/somYcVcJO3","Twitter Web App",115,NA,NA,NA,FALSE,FALSE,1,0,NA,NA,NA,NA,"nytimes.com/2020/05/05/us/…","https://t.co/somYcVcJO3","https://www.nytimes.com/2020/05/05/us/jared-kushner-fema-coronavirus.html?action=click&module=Spotlight&pgtype=Homepage",NA,NA,NA,NA,NA,NA,NA,NA,NA,NA,"en",NA,NA,NA,NA,NA,NA,NA,NA,NA,NA,NA,NA,NA,NA,NA,NA,NA,NA,NA,NA,NA,NA,NA,NA,NA,NA,NA,NA,NA,NA,NA,NA,NA,NA,NA,NA,NA,NA,NA,"https://twitter.com/AZTanya/status/1257863924776488966","Wash your hands and breathe the other way, please.","Phoenix, AZ","Underpinning philosophy of my life:. Try not to be too much of an asshole. 

try. it.",NA,FALSE,1699,1793,109,302689,19419,"2011/07/07 03:54:40",FALSE,NA,NA,NA,"https://pbs.twimg.com/profile_banners/330771231/1555180328","http://abs.twimg.com/images/themes/theme1/bg.png","http://pbs.twimg.com/profile_images/1097226455820292097/AO__QrP__normal.png"
"397",5206861,1257864356101976064,"2020/05/06 02:46:47","needcollegehelp","HigherEdJobs - ‘Pressure Is Turning Way Up’: College Presidents Plan Layoffs, Budget Cuts Due to #Coronavirus, Says Survey - https://t.co/Lt62hJIkJ1  @ASU run like a business not cutting back on #education #Arizona @huffpostcollege @Chronicle #employment #jobs","Twitter Web Client",260,NA,NA,NA,FALSE,FALSE,0,0,NA,NA,"Coronavirus, education, Arizona, employment, jobs",NA,"higheredjobs.com/Articles/artic…","https://t.co/Lt62hJIkJ1","https://www.higheredjobs.com/Articles/articleDisplay.cfm?ID=2208#.XrIa-bnjpkw.twitter",NA,NA,NA,NA,NA,NA,NA,NA,"18783501, 101896529, 12413032","ASU, HuffPostCollege, chronicle","en",NA,NA,NA,NA,NA,NA,NA,NA,NA,NA,NA,NA,NA,NA,NA,NA,NA,NA,NA,NA,NA,NA,NA,NA,NA,NA,NA,NA,NA,NA,NA,NA,NA,NA,NA,NA,NA,NA,NA,"https://twitter.com/needcollegehelp/status/1257864356101976069","Phil","Arizona, USA","Eduknowlogist believes EdTech solutions can close achievement gap💵🎓💵   😃 Educator💻coach, mentor and guide. Thoughts are my own. Too many damn Degrees🎓🎓🎓","https://t.co/aYp0of6SV1",FALSE,1192,290,276,16426,175288,"2007/04/19 09:21:58",FALSE,"https://t.co/aYp0of6SV1","https://needcollegehelp.com",NA,"https://pbs.twimg.com/profile_banners/5206861/1573789591","http://abs.twimg.com/images/themes/theme1/bg.png","http://pbs.twimg.com/profile_images/775524997888483328/Vf-8-3EG_normal.jpg"
"398",79691028,1257864328553787392,"2020/05/06 02:46:40","eselchuyyy","@iRaalphOnYou Covid
Rules 
Everything 
Around 
Me","Twitter for iPhone",35,1257843934207848448,1228762898794631168,"iRaalphOnYou",FALSE,FALSE,2,0,NA,NA,NA,NA,NA,NA,NA,NA,NA,NA,NA,NA,NA,NA,NA,"1228762898794631168","iRaalphOnYou","en",NA,NA,NA,NA,NA,NA,NA,NA,NA,NA,NA,NA,NA,NA,NA,NA,NA,NA,NA,NA,NA,NA,NA,NA,NA,NA,NA,NA,NA,NA,NA,NA,NA,NA,NA,NA,NA,NA,NA,"https://twitter.com/eselchuyyy/status/1257864328553787392","Jesus","Phoenix, AZ","🕺🏽🔉🚀⚾️🎱🌪🤘🏽👽🦖","https://t.co/slN2DEVTsR",FALSE,395,925,7,12508,11254,"2009/10/04 08:59:59",FALSE,"https://t.co/slN2DEVTsR","http://0110100010001000100100101001010.com",NA,"https://pbs.twimg.com/profile_banners/79691028/1574840231","http://abs.twimg.com/images/themes/theme1/bg.png","http://pbs.twimg.com/profile_images/1198319380003581952/HEcXWMd7_normal.jpg"
"399",4499006729,1257864043714326528,"2020/05/06 02:45:32","GreatMikeHawes","Moore Township pushes back real estate tax deadline to Aug. 31 - 69News WFMZ-TV https://t.co/W96PK9wsS7 https://t.co/YwmGua0Tar","dlvr.it",103,NA,NA,NA,FALSE,FALSE,0,0,NA,NA,NA,NA,"dlvr.it/RW559X","https://t.co/W96PK9wsS7","http://dlvr.it/RW559X","http://pbs.twimg.com/media/EXTUrn_UEAETcDQ.jpg","https://t.co/YwmGua0Tar","https://twitter.com/GreatMikeHawes/status/1257864043714326528/photo/1","photo","http://pbs.twimg.com/media/EXTUrn_UEAETcDQ.jpg","https://t.co/YwmGua0Tar","https://twitter.com/GreatMikeHawes/status/1257864043714326528/photo/1",NA,NA,NA,"en",NA,NA,NA,NA,NA,NA,NA,NA,NA,NA,NA,NA,NA,NA,NA,NA,NA,NA,NA,NA,NA,NA,NA,NA,NA,NA,NA,NA,NA,NA,NA,NA,NA,NA,NA,NA,NA,NA,NA,"https://twitter.com/GreatMikeHawes/status/1257864043714326528","Mike Hawes","Scottsdale, AZ","I'm a really great realtor living in Arizona. Like, really, really great. So great I'll knock your socks off.",NA,FALSE,148,78,21,19651,1,"2015/12/16 04:01:56",FALSE,NA,NA,NA,NA,NA,"http://pbs.twimg.com/profile_images/676976033485164544/YgVbkcaV_normal.jpg"
"400",44289321,1257863888780922880,"2020/05/06 02:44:55","arsheppy","I checked the worldwide covid 19 deaths on Sunday and it was at 247k. Tonight it’s at 257k.

TEN THOUSAND PEOPLE DIED IN TWO DAYS. I know the curve is flattening and it’s been worse in shorter spans of time but it’s still sad and scary.","Twitter for iPhone",236,NA,NA,NA,FALSE,FALSE,0,0,NA,NA,NA,NA,NA,NA,NA,NA,NA,NA,NA,NA,NA,NA,NA,NA,NA,"en",NA,NA,NA,NA,NA,NA,NA,NA,NA,NA,NA,NA,NA,NA,NA,NA,NA,NA,NA,NA,NA,NA,NA,NA,NA,NA,NA,NA,NA,NA,NA,NA,NA,NA,NA,NA,NA,NA,NA,"https://twitter.com/arsheppy/status/1257863888780922880","this keen dame","Arizona, USA","22. probably procrastinating. educator. cis she/her. #NotMyPresident. banner courtesy of @advil",NA,FALSE,293,660,5,19695,35907,"2009/06/03 04:07:41",FALSE,NA,NA,NA,"https://pbs.twimg.com/profile_banners/44289321/1547156739","http://abs.twimg.com/images/themes/theme6/bg.gif","http://pbs.twimg.com/profile_images/1249834672818798593/1Sw5r5Sx_normal.jpg"
"401",1326891811,1257863260625186816,"2020/05/06 02:42:25","AndyfromTucson","@mattyglesias Finally, the infamous restaurant cluster where people at adjacent tables caught Covid-19 from a presymptomatic diner.

https://t.co/6xOqBuPmpm","Twitter for iPhone",142,1257860736706965504,1326891811,"AndyfromTucson",FALSE,FALSE,0,0,NA,NA,NA,NA,"wwwnc.cdc.gov/eid/article/26…","https://t.co/6xOqBuPmpm","https://wwwnc.cdc.gov/eid/article/26/7/20-0764_article",NA,NA,NA,NA,NA,NA,NA,NA,"15446531","mattyglesias","en",NA,NA,NA,NA,NA,NA,NA,NA,NA,NA,NA,NA,NA,NA,NA,NA,NA,NA,NA,NA,NA,NA,NA,NA,NA,NA,NA,NA,NA,NA,NA,NA,NA,NA,NA,NA,NA,NA,NA,"https://twitter.com/AndyfromTucson/status/1257863260625186816","Andy Flach 🌵","Tucson, AZ","Desert rat",NA,FALSE,208,661,1,21982,57766,"2013/04/04 12:54:11",FALSE,NA,NA,NA,"https://pbs.twimg.com/profile_banners/1326891811/1484846158","http://abs.twimg.com/images/themes/theme1/bg.png","http://pbs.twimg.com/profile_images/822130271252201473/wjNygTbI_normal.jpg"
"402",836723526514049024,1257862954059366400,"2020/05/06 02:41:12","MonicaRubalcab3","@realDonaldTrump Dear Honorable President Donald Trump, please take a look at Nebulizing Colloidal silver at the onset of Coronavirus, so we can get back to work and preserve our economy. By trade I am a Respiratory therapist. Blessings to you and your family.","Twitter for Android",260,NA,25073877,"realDonaldTrump",FALSE,FALSE,0,0,NA,NA,NA,NA,NA,NA,NA,NA,NA,NA,NA,NA,NA,NA,NA,"25073877","realDonaldTrump","en",NA,NA,NA,NA,NA,NA,NA,NA,NA,NA,NA,NA,NA,NA,NA,NA,NA,NA,NA,NA,NA,NA,NA,NA,NA,NA,NA,NA,NA,NA,NA,NA,NA,NA,NA,NA,NA,NA,NA,"https://twitter.com/MonicaRubalcab3/status/1257862954059366401","Monica Rubalcaba","Vail, AZ",NA,NA,FALSE,63,276,0,603,202,"2017/02/28 23:43:29",FALSE,NA,NA,NA,"https://pbs.twimg.com/profile_banners/836723526514049026/1501130784",NA,"http://pbs.twimg.com/profile_images/890420611368878080/mJhKlSyC_normal.jpg"
"403",4490534239,1257862745250131968,"2020/05/06 02:40:23","3DTruth","These thermal cameras are more harmful than helpful bc about 80% of coronavirus infections are spread by asymptomatic people and thermal cameras provide a false sense of security. 
https://t.co/JaG4Mx3fBo","Twitter Web App",204,NA,NA,NA,FALSE,FALSE,12,5,NA,NA,NA,NA,"boston.cbslocal.com/2020/05/04/the…","https://t.co/JaG4Mx3fBo","https://boston.cbslocal.com/2020/05/04/thermal-camera-system-stoneham-apartment-coronavirus-pandemic/",NA,NA,NA,NA,NA,NA,NA,NA,NA,NA,"en",NA,NA,NA,NA,NA,NA,NA,NA,NA,NA,NA,NA,NA,NA,NA,NA,NA,NA,NA,NA,NA,NA,NA,NA,NA,NA,NA,NA,NA,NA,NA,NA,NA,NA,NA,NA,NA,NA,NA,"https://twitter.com/3DTruth/status/1257862745250131972","Margo Jones","Phoenix, Arizona","Soc. Democrat in Phoenix, AZ

#ClimateActionNow #Bernie2020, but I will vote for WHOEVER the Dem nominee is in Nov. bc I care abt the survival of planet earth.",NA,FALSE,65759,58843,187,67934,114590,"2015/12/07 22:40:30",FALSE,NA,NA,NA,"https://pbs.twimg.com/profile_banners/4490534239/1514522918","http://abs.twimg.com/images/themes/theme1/bg.png","http://pbs.twimg.com/profile_images/915791960127844358/A5WUXHY1_normal.jpg"
"404",922643073158410240,1257862640098922496,"2020/05/06 02:39:58","SoArizonaEsq","While everyone's distracted by coronavirus, Trump's quietly taking personal control of an agency he shouldn't be going anywhere near: The office of personnel management ⁦@lHELO!! ⁦@maddow⁩ ⁦@Lawrence⁩  https://t.co/dj5sLbD60g","Twitter for iPhone",225,NA,NA,NA,FALSE,FALSE,0,0,NA,NA,NA,NA,"independent.co.uk/voices/trump-c…","https://t.co/dj5sLbD60g","https://www.independent.co.uk/voices/trump-coronavirus-office-of-personnel-management-policies-a9500666.html",NA,NA,NA,NA,NA,NA,NA,NA,"187795176, 16129920, 158426909","Lhelo, maddow, Lawrence","en",NA,NA,NA,NA,NA,NA,NA,NA,NA,NA,NA,NA,NA,NA,NA,NA,NA,NA,NA,NA,NA,NA,NA,NA,NA,NA,NA,NA,NA,NA,NA,NA,NA,NA,NA,NA,NA,NA,NA,"https://twitter.com/SoArizonaEsq/status/1257862640098922496","§σ Aɾιȥσɳα E§ϙ  ⚖","Southern Arizona, USA","Lawyer. Feminist. Sentientist. Quean bearing the Sword of Justice and the #RuleOfLaw.   #FBR #MeToo #CatsResist #RBA #LawyersResist",NA,FALSE,4768,4584,7,19161,31227,"2017/10/24 01:57:05",FALSE,NA,NA,NA,"https://pbs.twimg.com/profile_banners/922643073158410241/1508811239","http://abs.twimg.com/images/themes/theme1/bg.png","http://pbs.twimg.com/profile_images/1012881420505628672/YFsaEwG3_normal.jpg"
"405",430459707,1257862466773463040,"2020/05/06 02:39:16","BranGoch","Americans are told to wash hands to fight coronavirus. But some don’t trust the tap. https://t.co/NHYcrfKhHj","Twitter Web Client",108,NA,NA,NA,FALSE,FALSE,0,0,NA,NA,NA,NA,"washingtonpost.com/national/ameri…","https://t.co/NHYcrfKhHj","https://www.washingtonpost.com/national/americans-are-told-to-wash-hands-to-fight-coronavirus-but-some-dont-trust-the-tap/2020/05/04/ca1ffd1c-87d3-11ea-ac8a-fe9b8088e101_story.html",NA,NA,NA,NA,NA,NA,NA,NA,NA,NA,"en",NA,NA,NA,NA,NA,NA,NA,NA,NA,NA,NA,NA,NA,NA,NA,NA,NA,NA,NA,NA,NA,NA,NA,NA,NA,NA,NA,NA,NA,NA,NA,NA,NA,NA,NA,NA,NA,NA,NA,"https://twitter.com/BranGoch/status/1257862466773463040","ffransis ap ffransis","Sonoran Desert, AZ","Blocked by Dana Loesch of the NRA!
No DMs--I don't respond.
""Liberty and Justice FOR ALL.""--No exceptions.
True Leveller (look it up)
I block bigots and racists","https://t.co/tGSYpjvYIM",FALSE,2179,5003,132,117228,35415,"2011/12/07 06:00:27",FALSE,"https://t.co/tGSYpjvYIM","https://www.facebook.com/CloneJack/",NA,"https://pbs.twimg.com/profile_banners/430459707/1398360548","http://abs.twimg.com/images/themes/theme10/bg.gif","http://pbs.twimg.com/profile_images/1073416074928914432/6MpAYPVr_normal.jpg"
"406",729427052,1257862384154079232,"2020/05/06 02:38:56","ClaudiaCJordan","Arizona state health department tells modeling team to stop work https://t.co/vdmTPEy54A","Twitter Web Client",88,NA,NA,NA,FALSE,FALSE,0,0,NA,NA,NA,NA,"abc15.com/news/coronavir…","https://t.co/vdmTPEy54A","https://www.abc15.com/news/coronavirus/arizona-state-health-department-tells-modeling-team-to-stop-work",NA,NA,NA,NA,NA,NA,NA,NA,NA,NA,"en",NA,NA,NA,NA,NA,NA,NA,NA,NA,NA,NA,NA,NA,NA,NA,NA,NA,NA,NA,NA,NA,NA,NA,NA,NA,NA,NA,NA,NA,NA,NA,NA,NA,NA,NA,NA,NA,NA,NA,"https://twitter.com/ClaudiaCJordan/status/1257862384154079232","Claudia Jordan","Scottsdale, AZ","Fierce Entrepreneur, Hiker, Former Republican; Member of the Resistance, Volcano Owner, Bomb Ass Ridah, Believe Abraham when they say: It's on its way.",NA,FALSE,159,116,2,11808,17177,"2012/07/31 22:53:18",FALSE,NA,NA,NA,"https://pbs.twimg.com/profile_banners/729427052/1572131166","http://abs.twimg.com/images/themes/theme1/bg.png","http://pbs.twimg.com/profile_images/943972132941307905/cc4jyaXB_normal.jpg"
"407",729427052,1257861876404195328,"2020/05/06 02:36:55","ClaudiaCJordan","""Amazon engineer quits after he ‘snapped’ when the company fired workers who called for coronavirus protections"" https://t.co/AsdrZ5mbAS","Twitter Web Client",136,NA,NA,NA,FALSE,FALSE,0,0,NA,NA,NA,NA,"cnbc.com/2020/05/04/ama…","https://t.co/AsdrZ5mbAS","https://www.cnbc.com/2020/05/04/amazon-engineer-resigns-over-companys-treatment-of-workers.html?__source=sharebar|twitter&par=sharebar",NA,NA,NA,NA,NA,NA,NA,NA,NA,NA,"en",NA,NA,NA,NA,NA,NA,NA,NA,NA,NA,NA,NA,NA,NA,NA,NA,NA,NA,NA,NA,NA,NA,NA,NA,NA,NA,NA,NA,NA,NA,NA,NA,NA,NA,NA,NA,NA,NA,NA,"https://twitter.com/ClaudiaCJordan/status/1257861876404195329","Claudia Jordan","Scottsdale, AZ","Fierce Entrepreneur, Hiker, Former Republican; Member of the Resistance, Volcano Owner, Bomb Ass Ridah, Believe Abraham when they say: It's on its way.",NA,FALSE,159,116,2,11808,17177,"2012/07/31 22:53:18",FALSE,NA,NA,NA,"https://pbs.twimg.com/profile_banners/729427052/1572131166","http://abs.twimg.com/images/themes/theme1/bg.png","http://pbs.twimg.com/profile_images/943972132941307905/cc4jyaXB_normal.jpg"
"408",729427052,1257844638385180672,"2020/05/06 01:28:26","ClaudiaCJordan","WTAF!  #ArizonaCovidiots @DougDucey  Arizona state health department tells modeling team to stop work https://t.co/vdmTPEy54A","Twitter Web Client",125,NA,NA,NA,FALSE,FALSE,0,0,NA,NA,"ArizonaCovidiots",NA,"abc15.com/news/coronavir…","https://t.co/vdmTPEy54A","https://www.abc15.com/news/coronavirus/arizona-state-health-department-tells-modeling-team-to-stop-work",NA,NA,NA,NA,NA,NA,NA,NA,"20217019","dougducey","en",NA,NA,NA,NA,NA,NA,NA,NA,NA,NA,NA,NA,NA,NA,NA,NA,NA,NA,NA,NA,NA,NA,NA,NA,NA,NA,NA,NA,NA,NA,NA,NA,NA,NA,NA,NA,NA,NA,NA,"https://twitter.com/ClaudiaCJordan/status/1257844638385180672","Claudia Jordan","Scottsdale, AZ","Fierce Entrepreneur, Hiker, Former Republican; Member of the Resistance, Volcano Owner, Bomb Ass Ridah, Believe Abraham when they say: It's on its way.",NA,FALSE,159,116,2,11808,17177,"2012/07/31 22:53:18",FALSE,NA,NA,NA,"https://pbs.twimg.com/profile_banners/729427052/1572131166","http://abs.twimg.com/images/themes/theme1/bg.png","http://pbs.twimg.com/profile_images/943972132941307905/cc4jyaXB_normal.jpg"
"409",96058779,1257862304588197888,"2020/05/06 02:38:38","MarcieMSantos","@robreiner I so agree. Not the time to disband the Coronavirus Task Force. The death numbers will continue to climb but the economy is more important to trump than the number of deaths.","Twitter for iPhone",174,1257814184722436096,738080573365702656,"robreiner",FALSE,FALSE,0,0,NA,NA,NA,NA,NA,NA,NA,NA,NA,NA,NA,NA,NA,NA,NA,"738080573365702657","robreiner","en",NA,NA,NA,NA,NA,NA,NA,NA,NA,NA,NA,NA,NA,NA,NA,NA,NA,NA,NA,NA,NA,NA,NA,NA,NA,NA,NA,NA,NA,NA,NA,NA,NA,NA,NA,NA,NA,NA,NA,"https://twitter.com/MarcieMSantos/status/1257862304588197888","marcella santos","Phoenix, AZ",NA,NA,FALSE,5,59,0,416,926,"2009/12/11 04:42:35",FALSE,NA,NA,NA,NA,"http://abs.twimg.com/images/themes/theme1/bg.png","http://abs.twimg.com/sticky/default_profile_images/default_profile_normal.png"
"410",194914226,1257861957949902848,"2020/05/06 02:37:15","JesseRomero09","This was suppose to be the year I travel, fuck this covid-19","Twitter for iPhone",60,NA,NA,NA,FALSE,FALSE,0,0,NA,NA,NA,NA,NA,NA,NA,NA,NA,NA,NA,NA,NA,NA,NA,NA,NA,"en",NA,NA,NA,NA,NA,NA,NA,NA,NA,NA,NA,NA,NA,NA,NA,NA,NA,NA,NA,NA,NA,NA,NA,NA,NA,NA,NA,NA,NA,NA,NA,NA,NA,NA,NA,NA,NA,NA,NA,"https://twitter.com/JesseRomero09/status/1257861957949902850","Jesse","Arizona, USA","• 24 •",NA,FALSE,27,43,0,738,18,"2010/09/25 09:10:01",FALSE,NA,NA,NA,"https://pbs.twimg.com/profile_banners/194914226/1571537387","http://abs.twimg.com/images/themes/theme1/bg.png","http://pbs.twimg.com/profile_images/1171995535898628096/c6I4TbH6_normal.jpg"
"411",463268983,1257861489483866112,"2020/05/06 02:35:23","jman8964","@cm_merlin @RawStory @TheDemocrats @HouseDemocrats @SenateDems @HouseJudiciary But he does believe there is a Chinese conspiracy to infect the US with a laboratory created COVID virus. #flabbyone","Twitter for iPad",116,1257717049389985792,28241597,"cm_merlin",FALSE,FALSE,1,0,NA,NA,"flabbyone",NA,NA,NA,NA,NA,NA,NA,NA,NA,NA,NA,NA,"28241597, 16041234, 14377605, 43963249, 73238146, 246357149","cm_merlin, RawStory, TheDemocrats, HouseDemocrats, SenateDems, HouseJudiciary","en",NA,NA,NA,NA,NA,NA,NA,NA,NA,NA,NA,NA,NA,NA,NA,NA,NA,NA,NA,NA,NA,NA,NA,NA,NA,NA,NA,NA,NA,NA,NA,NA,NA,NA,NA,NA,NA,NA,NA,"https://twitter.com/jman8964/status/1257861489483866113","Jason Ferguson","Chandler, AZ","Educator, musician, husband, father, Ojibwa, Canadian living abroad","https://t.co/WzMk8k8gQ0",FALSE,1075,3547,5,4748,8784,"2012/01/13 22:39:59",FALSE,"https://t.co/WzMk8k8gQ0","https://soundcloud.com/jman1283/sets/all-tracks",NA,"https://pbs.twimg.com/profile_banners/463268983/1559177886","http://abs.twimg.com/images/themes/theme1/bg.png","http://pbs.twimg.com/profile_images/925283063277305858/_7pjKG3h_normal.jpg"
"412",17187236,1257861164945596416,"2020/05/06 02:34:06","12News","The Navajo Nation said it would get more than $600 million to fight coronavirus. https://t.co/G3HKdWWTYe","SocialNewsDesk",104,NA,NA,NA,FALSE,FALSE,7,1,NA,NA,NA,NA,"12news.com/article/news/h…","https://t.co/G3HKdWWTYe","https://www.12news.com/article/news/health/coronavirus/treasury-to-begin-distributing-virus-relief-money-to-tribes/75-be0e7bc7-0870-4a12-9cf2-eddbc6a1078b",NA,NA,NA,NA,NA,NA,NA,NA,NA,NA,"en",NA,NA,NA,NA,NA,NA,NA,NA,NA,NA,NA,NA,NA,NA,NA,NA,NA,NA,NA,NA,NA,NA,NA,NA,NA,NA,NA,NA,NA,NA,NA,NA,NA,NA,NA,NA,NA,NA,NA,"https://twitter.com/12News/status/1257861164945596416","12 News","Arizona, USA","At 12 News, we listen, we seek, and we solve for the people of #Arizona. News tip? connect@12news.com or 602-444-1212. A TEGNA company.","https://t.co/D6UdXqsaH2",FALSE,214638,11712,1745,384312,20756,"2008/11/05 12:15:42",TRUE,"https://t.co/D6UdXqsaH2","http://12news.com/",NA,"https://pbs.twimg.com/profile_banners/17187236/1557960878","http://abs.twimg.com/images/themes/theme14/bg.gif","http://pbs.twimg.com/profile_images/968094190063136768/cHeX6ASU_normal.jpg"
"413",196182278,1257861034351550464,"2020/05/06 02:33:35","WCaddict","Arizona state health department tells modeling team to stop work https://t.co/gHZ2IrijqH","Twitter Web App",88,NA,NA,NA,FALSE,FALSE,0,0,NA,NA,NA,NA,"abc15.com/news/coronavir…","https://t.co/gHZ2IrijqH","https://www.abc15.com/news/coronavirus/arizona-state-health-department-tells-modeling-team-to-stop-work",NA,NA,NA,NA,NA,NA,NA,NA,NA,NA,"en",NA,NA,NA,NA,NA,NA,NA,NA,NA,NA,NA,NA,NA,NA,NA,NA,NA,NA,NA,NA,NA,NA,NA,NA,NA,NA,NA,NA,NA,NA,NA,NA,NA,NA,NA,NA,NA,NA,NA,"https://twitter.com/WCaddict/status/1257861034351550466","debbie martinsen","Mesa, AZ","Mother. Grandmother. Former Republican. 
#environment #education #equalrights #animalwelfare",NA,FALSE,1845,2126,118,274179,173224,"2010/09/28 14:41:32",FALSE,NA,NA,NA,NA,"http://abs.twimg.com/images/themes/theme4/bg.gif","http://pbs.twimg.com/profile_images/460956020802478080/F0uO33x5_normal.jpeg"
"414",938212380,1257860686983475200,"2020/05/06 02:32:12","beadiegolazaro","Very inyeresting article about EHDI and COVID by Dr. Yoshinaga-Itano #slpeeps
#audpeeps https://t.co/MokNR2tEOv","Twitter for Android",111,NA,NA,NA,FALSE,FALSE,0,0,NA,NA,"slpeeps, audpeeps",NA,"journals.lww.com/thehearingjour…","https://t.co/MokNR2tEOv","https://journals.lww.com/thehearingjournal/fulltext/2020/05000/challenges_to_ehdi_systems_amid_the_covid_19.15.aspx",NA,NA,NA,NA,NA,NA,NA,NA,NA,NA,"en",NA,NA,NA,NA,NA,NA,NA,NA,NA,NA,NA,NA,NA,NA,NA,NA,NA,NA,NA,NA,NA,NA,NA,NA,NA,NA,NA,NA,NA,NA,"https://api.twitter.com/1.1/geo/id/0a0de7bd49ef942d.json","Scottsdale","Scottsdale, AZ","city","United States","US",NA,NA,"-111.960775, -111.756022, -111.756022, -111.960775, 33.4358637, 33.4358637, 33.842816, 33.842816","https://twitter.com/beadiegolazaro/status/1257860686983475201","Beatriz de Diego-Lázaro","Arizona, USA","Assistant Professor at Midwestern University,  Speech-Language Pathology
🇪🇦🇪🇺🇺🇸",NA,FALSE,181,483,1,103,1636,"2012/11/10 02:26:32",FALSE,NA,NA,NA,"https://pbs.twimg.com/profile_banners/938212380/1535774210","http://abs.twimg.com/images/themes/theme1/bg.png","http://pbs.twimg.com/profile_images/1035737850157752320/SlzaIAdk_normal.jpg"
"415",186712624,1257860327129006080,"2020/05/06 02:30:46","KikuyuPrince","@azcentral If we stop talking about Covid, studying it and testing for it ,it will go away! --GOP leaders. 🙈🙉🙊","Twitter for Android",99,1257849536204156928,13115682,"azcentral",FALSE,FALSE,1,0,NA,NA,NA,NA,NA,NA,NA,NA,NA,NA,NA,NA,NA,NA,NA,"13115682","azcentral","en",NA,NA,NA,NA,NA,NA,NA,NA,NA,NA,NA,NA,NA,NA,NA,NA,NA,NA,NA,NA,NA,NA,NA,NA,NA,NA,NA,NA,NA,NA,NA,NA,NA,NA,NA,NA,NA,NA,NA,"https://twitter.com/KikuyuPrince/status/1257860327129006081","African Prince","Phoenix, AZ","Dad, husband, patriot, beer drinker. PhD in sarcasm.  Proudly never retweeted by POTUS. follow me, I follow back.",NA,FALSE,209,1520,0,1061,318,"2010/09/04 05:11:49",FALSE,NA,NA,NA,NA,"http://abs.twimg.com/images/themes/theme1/bg.png","http://pbs.twimg.com/profile_images/470814866123403264/LvMgcVXZ_normal.jpeg"
"416",269591211,1257860247152029696,"2020/05/06 02:30:27","frankznbeanies","Tucker: Policymakers just can't stop breaking coronavirus rules https://t.co/dsG6lFK6pi via @YouTube","Twitter Web Client",100,NA,NA,NA,FALSE,FALSE,0,0,NA,NA,NA,NA,"youtu.be/GFNvcw12d08","https://t.co/dsG6lFK6pi","https://youtu.be/GFNvcw12d08",NA,NA,NA,NA,NA,NA,NA,NA,"10228272","YouTube","en",NA,NA,NA,NA,NA,NA,NA,NA,NA,NA,NA,NA,NA,NA,NA,NA,NA,NA,NA,NA,NA,NA,NA,NA,NA,NA,NA,NA,NA,NA,NA,NA,NA,NA,NA,NA,NA,NA,NA,"https://twitter.com/frankznbeanies/status/1257860247152029697","John OConnor","Phoenix, AZ","Hurdling thru space,bursting thru Earth's atmosphere, Maddie Mad Dog Ziegler running wild in the nite, tearing up the dance world and ripping hearts apart.",NA,FALSE,106,37,5,11229,25254,"2011/03/21 02:43:28",FALSE,NA,NA,NA,"https://pbs.twimg.com/profile_banners/269591211/1528832670","http://abs.twimg.com/images/themes/theme1/bg.png","http://pbs.twimg.com/profile_images/1006623696822259712/o9AThtN-_normal.jpg"
