"","user_id","status_id","created_at","screen_name","text","source","display_text_width","reply_to_status_id","reply_to_user_id","reply_to_screen_name","is_quote","is_retweet","favorite_count","retweet_count","quote_count","reply_count","hashtags","symbols","urls_url","urls_t.co","urls_expanded_url","media_url","media_t.co","media_expanded_url","media_type","ext_media_url","ext_media_t.co","ext_media_expanded_url","ext_media_type","mentions_user_id","mentions_screen_name","lang","quoted_status_id","quoted_text","quoted_created_at","quoted_source","quoted_favorite_count","quoted_retweet_count","quoted_user_id","quoted_screen_name","quoted_name","quoted_followers_count","quoted_friends_count","quoted_statuses_count","quoted_location","quoted_description","quoted_verified","retweet_status_id","retweet_text","retweet_created_at","retweet_source","retweet_favorite_count","retweet_retweet_count","retweet_user_id","retweet_screen_name","retweet_name","retweet_followers_count","retweet_friends_count","retweet_statuses_count","retweet_location","retweet_description","retweet_verified","place_url","place_name","place_full_name","place_type","country","country_code","geo_coords","coords_coords","bbox_coords","status_url","name","location","description","url","protected","followers_count","friends_count","listed_count","statuses_count","favourites_count","account_created_at","verified","profile_url","profile_expanded_url","account_lang","profile_banner_url","profile_background_url","profile_image_url"
"1",2874431273,1.257832168581e+18,"2020/05/06 00:38:53","MichaelKoza1","When did reporting out the number a football player will wear on their new team become news? 

Okay Covid, you win","Twitter for iPhone",114,NA,NA,NA,FALSE,FALSE,0,0,NA,NA,NA,NA,NA,NA,NA,NA,NA,NA,NA,NA,NA,NA,NA,NA,NA,"en",NA,NA,NA,NA,NA,NA,NA,NA,NA,NA,NA,NA,NA,NA,NA,NA,NA,NA,NA,NA,NA,NA,NA,NA,NA,NA,NA,NA,NA,NA,NA,NA,NA,NA,NA,NA,NA,NA,NA,"https://twitter.com/MichaelKoza1/status/1257832168581001216","Michael Koza","Tucson, AZ","Husband,Daddy, a Philadelphia fan. When you live in the best climate in the U.S. - UArizona",NA,FALSE,66,481,6,1988,2793,"2014/11/12 23:35:26",FALSE,NA,NA,NA,"https://pbs.twimg.com/profile_banners/2874431273/1415843810","http://abs.twimg.com/images/themes/theme1/bg.png","http://pbs.twimg.com/profile_images/532954900981104640/tAWdtKPs_normal.jpeg"
"2",106800773,1257832160137895936,"2020/05/06 00:38:51","MichaelENewton1","Nobel Prize winning biologist: ""When we come to look back on this, the damage done by lockdown will exceed any saving of lives by a huge factor."" https://t.co/aIgzM67E4K
#Coronavirus #COVID19","Twitter Web App",191,NA,NA,NA,FALSE,FALSE,0,0,NA,NA,"Coronavirus, COVID19",NA,"unherd.com/thepost/nobel-…","https://t.co/aIgzM67E4K","https://unherd.com/thepost/nobel-prize-winning-scientist-the-covid-19-epidemic-was-never-exponential/",NA,NA,NA,NA,NA,NA,NA,NA,NA,NA,"en",NA,NA,NA,NA,NA,NA,NA,NA,NA,NA,NA,NA,NA,NA,NA,NA,NA,NA,NA,NA,NA,NA,NA,NA,NA,NA,NA,NA,NA,NA,NA,NA,NA,NA,NA,NA,NA,NA,NA,"https://twitter.com/MichaelENewton1/status/1257832160137895936","Michael E. Newton","Phoenix, AZ","Historian/author: 
""Discovering Hamilton""
""Alexander Hamilton: The Formative Years""
""The Path To Tyranny""
""Angry Mobs and Founding Fathers""","http://t.co/gINsPXFr3M",FALSE,13061,8006,464,36805,15692,"2010/01/20 18:49:49",FALSE,"http://t.co/gINsPXFr3M","http://www.michaelenewton.com",NA,"https://pbs.twimg.com/profile_banners/106800773/1560813462","http://abs.twimg.com/images/themes/theme4/bg.gif","http://pbs.twimg.com/profile_images/1053334600552828928/bQ3ZylBC_normal.jpg"
"3",106800773,1257831408950628352,"2020/05/06 00:35:51","MichaelENewton1","""Despite pandemic, Israel’s death rate dropped 12% in March compared to last year"" https://t.co/QqbNBrf9Mv
#Coronavirus #COVID19","Twitter Web App",128,NA,NA,NA,FALSE,FALSE,1,0,NA,NA,"Coronavirus, COVID19",NA,"timesofisrael.com/despite-pandem…","https://t.co/QqbNBrf9Mv","https://www.timesofisrael.com/despite-pandemic-israels-death-rate-dropped-12-in-march-compared-to-last-year/",NA,NA,NA,NA,NA,NA,NA,NA,NA,NA,"en",NA,NA,NA,NA,NA,NA,NA,NA,NA,NA,NA,NA,NA,NA,NA,NA,NA,NA,NA,NA,NA,NA,NA,NA,NA,NA,NA,NA,NA,NA,NA,NA,NA,NA,NA,NA,NA,NA,NA,"https://twitter.com/MichaelENewton1/status/1257831408950628352","Michael E. Newton","Phoenix, AZ","Historian/author: 
""Discovering Hamilton""
""Alexander Hamilton: The Formative Years""
""The Path To Tyranny""
""Angry Mobs and Founding Fathers""","http://t.co/gINsPXFr3M",FALSE,13061,8006,464,36805,15692,"2010/01/20 18:49:49",FALSE,"http://t.co/gINsPXFr3M","http://www.michaelenewton.com",NA,"https://pbs.twimg.com/profile_banners/106800773/1560813462","http://abs.twimg.com/images/themes/theme4/bg.gif","http://pbs.twimg.com/profile_images/1053334600552828928/bQ3ZylBC_normal.jpg"
"4",997135862545563648,1257832106656333824,"2020/05/06 00:38:38","MorozkoForge","The more evidence we get, the more convincing the case that COVID arrived in the US in Nov2019, like @AJKayWriter and @seagertp said in the article @Medium banned for being ""dangerous."" https://t.co/v4GIBWeUxS https://t.co/o1wKcmEyww","Twitter for Android",209,NA,NA,NA,TRUE,FALSE,0,0,NA,NA,NA,NA,"morozkoforge.com/post/the-curve…, twitter.com/AJKayWriter/st…","https://t.co/v4GIBWeUxS, https://t.co/o1wKcmEyww","https://www.morozkoforge.com/post/the-curve-is-already-flat, https://twitter.com/AJKayWriter/status/1257830422752313345",NA,NA,NA,NA,NA,NA,NA,NA,"993268289227780096, 458615118, 571202103","AJKayWriter, seagertp, Medium","en",1257830422752313344,"Excerpt from the paper published today in Infection, Genetics, &amp; Evolution, which is the source for the CNN article: 

https://t.co/Otez4yh7L4 https://t.co/RE6JKCcTG4","2020/05/06 00:31:56","Twitter for iPhone",1,1,993268289227780096,"AJKayWriter","A.J. Kay",1896,396,1903,"Tempe, AZ","Writing/Research, Marmee to 4 little women, Freelance, Politically displaced pragmatist, Author of ""The Curve Is Already Flat"" & a bunch of other stuff",FALSE,NA,NA,NA,NA,NA,NA,NA,NA,NA,NA,NA,NA,NA,NA,NA,NA,NA,NA,NA,NA,NA,NA,NA,NA,"https://twitter.com/MorozkoForge/status/1257832106656333825","MorozkoForge","Phoenix, AZ","Developing tools for #hormesis through deliberate cold exposure. #antifragility #icebath #stressinoculation","https://t.co/TuiWTd9Ggs",FALSE,353,259,6,1528,4256,"2018/05/17 15:24:50",FALSE,"https://t.co/TuiWTd9Ggs","http://MorozkoForge.com",NA,"https://pbs.twimg.com/profile_banners/997135862545563648/1554154545",NA,"http://pbs.twimg.com/profile_images/1112829183497953281/ZWEA4ZOD_normal.png"
"5",3380773569,1257831969225756672,"2020/05/06 00:38:05","KAWCnews","Yuma County Announces Largest Jump in COVID-19 Cases With 18 Due To More Testing

#COVID19 #Arizona #Yuma #testing
https://t.co/doMdh0UybK","Twitter Web App",138,NA,NA,NA,FALSE,FALSE,0,0,NA,NA,"COVID19, Arizona, Yuma, testing",NA,"kawc.org/post/yuma-coun…","https://t.co/doMdh0UybK","https://www.kawc.org/post/yuma-county-announces-largest-jump-covid-19-cases-18-due-more-testing",NA,NA,NA,NA,NA,NA,NA,NA,NA,NA,"en",NA,NA,NA,NA,NA,NA,NA,NA,NA,NA,NA,NA,NA,NA,NA,NA,NA,NA,NA,NA,NA,NA,NA,NA,NA,NA,NA,NA,NA,NA,NA,NA,NA,NA,NA,NA,NA,NA,NA,"https://twitter.com/KAWCnews/status/1257831969225756672","KAWC News","Yuma, AZ","Reports from the @KAWC 88.9 FM Newsroom. We are Colorado River Public Media @NPR a service of @ArizonaWestern for 50 years. Follows/likes/RTs ≠ endorsements","http://t.co/c42lW057RR",FALSE,281,568,4,1190,2875,"2015/07/17 20:26:22",FALSE,"http://t.co/c42lW057RR","http://kawc.org",NA,"https://pbs.twimg.com/profile_banners/3380773569/1587674386","http://abs.twimg.com/images/themes/theme1/bg.png","http://pbs.twimg.com/profile_images/1162503233048211456/B8trQ79A_normal.jpg"
"6",984161232549593088,1257831917702897664,"2020/05/06 00:37:53","EchoFaine","Would anyone be interested in a matching mask/scrunchie pack that proceeds from would go to a covid relief fund?","Twitter for iPhone",112,NA,NA,NA,FALSE,FALSE,0,0,NA,NA,NA,NA,NA,NA,NA,NA,NA,NA,NA,NA,NA,NA,NA,NA,NA,"en",NA,NA,NA,NA,NA,NA,NA,NA,NA,NA,NA,NA,NA,NA,NA,NA,NA,NA,NA,NA,NA,NA,NA,NA,NA,NA,NA,NA,NA,NA,NA,NA,NA,NA,NA,NA,NA,NA,NA,"https://twitter.com/EchoFaine/status/1257831917702897666","Echo @ 😷","Tucson, AZ","Full Time Cosplay Commissioner - Echo 23 she/her - 🔜 Fanime-Current Personal Project: DAI Warden Armor- Commission Link below 🔻🔻🔻","https://t.co/WTznX4MoWQ",FALSE,224,278,0,5349,4174,"2018/04/11 20:08:17",FALSE,"https://t.co/WTznX4MoWQ","https://docs.google.com/forms/d/e/1FAIpQLSe4YJm7KVlCm9lc3zIUDgcIt2qt-HG-5iH7FDEpuSWDYgU_xg/viewform",NA,"https://pbs.twimg.com/profile_banners/984161232549593088/1555392623",NA,"http://pbs.twimg.com/profile_images/1134695810082279429/L4NZYNmE_normal.png"
"7",940013948,1257831909897326592,"2020/05/06 00:37:51","nickgriemsmann","#LIVESTREAM #Coronavirus #prayers for you, your family, and the world. Please #retweet and share to encourage others. God bless you! https://t.co/DA8KsdnXUH","Twitter for iPhone",156,NA,NA,NA,FALSE,FALSE,0,0,NA,NA,"LIVESTREAM, Coronavirus, prayers, retweet",NA,"facebook.com/nickgriemsmann…","https://t.co/DA8KsdnXUH","https://www.facebook.com/nickgriemsmann/videos/261501078556814/",NA,NA,NA,NA,NA,NA,NA,NA,NA,NA,"en",NA,NA,NA,NA,NA,NA,NA,NA,NA,NA,NA,NA,NA,NA,NA,NA,NA,NA,NA,NA,NA,NA,NA,NA,NA,NA,NA,NA,NA,NA,NA,NA,NA,NA,NA,NA,NA,NA,NA,"https://twitter.com/nickgriemsmann/status/1257831909897326597","Nick Griemsmann","Phoenix, AZ","Founder of The Father's Friends Ministry / Need Prayer? Need Jesus? Call the Eternal Life Line: 1-888-KNOW-HIM","https://t.co/h6jD0r3tvk",FALSE,670,0,26,60,0,"2012/11/10 21:53:29",FALSE,"https://t.co/h6jD0r3tvk","http://www.TheFathersFriends.org",NA,"https://pbs.twimg.com/profile_banners/940013948/1520292591","http://abs.twimg.com/images/themes/theme15/bg.png","http://pbs.twimg.com/profile_images/966061911061098496/WddMENvv_normal.jpg"
"8",967156660895494144,1257831806042140672,"2020/05/06 00:37:26","TheBeeAZ","Sonora Quest will provide 500 COVID-19 testing kits for Saturday at Anderson Auto Group Fieldhouse https://t.co/zWvxWl2J5L","WordPress.com",122,NA,NA,NA,FALSE,FALSE,0,0,NA,NA,NA,NA,"thebee.news/sonora-quest-w…","https://t.co/zWvxWl2J5L","https://www.thebee.news/sonora-quest-will-provide-500-covid-19-testing-kits-for-saturday-at-anderson-auto-group-fieldhouse/",NA,NA,NA,NA,NA,NA,NA,NA,NA,NA,"en",NA,NA,NA,NA,NA,NA,NA,NA,NA,NA,NA,NA,NA,NA,NA,NA,NA,NA,NA,NA,NA,NA,NA,NA,NA,NA,NA,NA,NA,NA,NA,NA,NA,NA,NA,NA,NA,NA,NA,"https://twitter.com/TheBeeAZ/status/1257831806042140672","The Bee","Bullhead City, AZ","To provide breaking and up-to-date news to the Tri-state community. RT are not endorsements.",NA,FALSE,288,527,5,2006,396,"2018/02/23 21:58:11",FALSE,NA,NA,NA,"https://pbs.twimg.com/profile_banners/967156660895494144/1544730911",NA,"http://pbs.twimg.com/profile_images/1073305479898574848/IDs2Vi6B_normal.jpg"
"9",118200525,1257831778456403968,"2020/05/06 00:37:20","NeilRetail","🇦🇺 Bunnings boss calls for industrial relations scrutiny in wake of COVID-19 https://t.co/1UupTL091w","Buffer",100,NA,NA,NA,FALSE,FALSE,0,0,NA,NA,NA,NA,"bit.ly/3fsuvL8","https://t.co/1UupTL091w","https://bit.ly/3fsuvL8",NA,NA,NA,NA,NA,NA,NA,NA,NA,NA,"en",NA,NA,NA,NA,NA,NA,NA,NA,NA,NA,NA,NA,NA,NA,NA,NA,NA,NA,NA,NA,NA,NA,NA,NA,NA,NA,NA,NA,NA,NA,NA,NA,NA,NA,NA,NA,NA,NA,NA,"https://twitter.com/NeilRetail/status/1257831778456403968","Neil Saunders","Scottsdale, AZ","Managing Director of GlobalData Retail, founder of Conlumino. I analyze all sorts of things to do with retail, shopping, and consumers.","https://t.co/1J4V73SPCW",FALSE,20929,3199,610,105924,20015,"2010/02/27 22:42:10",TRUE,"https://t.co/1J4V73SPCW","http://uk.linkedin.com/in/neilretail",NA,"https://pbs.twimg.com/profile_banners/118200525/1499432114","http://abs.twimg.com/images/themes/theme13/bg.gif","http://pbs.twimg.com/profile_images/800766921859731456/L7n6KzrE_normal.jpg"
"10",118200525,1257830902756806656,"2020/05/06 00:33:51","NeilRetail","🇦🇺 Zip rides online retail surge amid COVID-19 pandemic https://t.co/hazPpwqaz0","Buffer",79,NA,NA,NA,FALSE,FALSE,0,0,NA,NA,NA,NA,"bit.ly/3cahp2R","https://t.co/hazPpwqaz0","https://bit.ly/3cahp2R",NA,NA,NA,NA,NA,NA,NA,NA,NA,NA,"en",NA,NA,NA,NA,NA,NA,NA,NA,NA,NA,NA,NA,NA,NA,NA,NA,NA,NA,NA,NA,NA,NA,NA,NA,NA,NA,NA,NA,NA,NA,NA,NA,NA,NA,NA,NA,NA,NA,NA,"https://twitter.com/NeilRetail/status/1257830902756806658","Neil Saunders","Scottsdale, AZ","Managing Director of GlobalData Retail, founder of Conlumino. I analyze all sorts of things to do with retail, shopping, and consumers.","https://t.co/1J4V73SPCW",FALSE,20929,3199,610,105924,20015,"2010/02/27 22:42:10",TRUE,"https://t.co/1J4V73SPCW","http://uk.linkedin.com/in/neilretail",NA,"https://pbs.twimg.com/profile_banners/118200525/1499432114","http://abs.twimg.com/images/themes/theme13/bg.gif","http://pbs.twimg.com/profile_images/800766921859731456/L7n6KzrE_normal.jpg"
"11",118200525,1257831417150660608,"2020/05/06 00:35:53","NeilRetail","🇦🇺 Shoppers, investors put coronavirus twist on buy local mantra https://t.co/nlPQTd6l9N","Buffer",88,NA,NA,NA,FALSE,FALSE,0,0,NA,NA,NA,NA,"bit.ly/35yHlTk","https://t.co/nlPQTd6l9N","https://bit.ly/35yHlTk",NA,NA,NA,NA,NA,NA,NA,NA,NA,NA,"en",NA,NA,NA,NA,NA,NA,NA,NA,NA,NA,NA,NA,NA,NA,NA,NA,NA,NA,NA,NA,NA,NA,NA,NA,NA,NA,NA,NA,NA,NA,NA,NA,NA,NA,NA,NA,NA,NA,NA,"https://twitter.com/NeilRetail/status/1257831417150660608","Neil Saunders","Scottsdale, AZ","Managing Director of GlobalData Retail, founder of Conlumino. I analyze all sorts of things to do with retail, shopping, and consumers.","https://t.co/1J4V73SPCW",FALSE,20929,3199,610,105924,20015,"2010/02/27 22:42:10",TRUE,"https://t.co/1J4V73SPCW","http://uk.linkedin.com/in/neilretail",NA,"https://pbs.twimg.com/profile_banners/118200525/1499432114","http://abs.twimg.com/images/themes/theme13/bg.gif","http://pbs.twimg.com/profile_images/800766921859731456/L7n6KzrE_normal.jpg"
"12",118200525,1257831160551477248,"2020/05/06 00:34:52","NeilRetail","🇦🇺 Retail reborn: The shops set to open their doors after temporary COVID-19 closedowns https://t.co/pKpD6Bq8hi","Buffer",111,NA,NA,NA,FALSE,FALSE,0,0,NA,NA,NA,NA,"bit.ly/3caJO91","https://t.co/pKpD6Bq8hi","https://bit.ly/3caJO91",NA,NA,NA,NA,NA,NA,NA,NA,NA,NA,"en",NA,NA,NA,NA,NA,NA,NA,NA,NA,NA,NA,NA,NA,NA,NA,NA,NA,NA,NA,NA,NA,NA,NA,NA,NA,NA,NA,NA,NA,NA,NA,NA,NA,NA,NA,NA,NA,NA,NA,"https://twitter.com/NeilRetail/status/1257831160551477249","Neil Saunders","Scottsdale, AZ","Managing Director of GlobalData Retail, founder of Conlumino. I analyze all sorts of things to do with retail, shopping, and consumers.","https://t.co/1J4V73SPCW",FALSE,20929,3199,610,105924,20015,"2010/02/27 22:42:10",TRUE,"https://t.co/1J4V73SPCW","http://uk.linkedin.com/in/neilretail",NA,"https://pbs.twimg.com/profile_banners/118200525/1499432114","http://abs.twimg.com/images/themes/theme13/bg.gif","http://pbs.twimg.com/profile_images/800766921859731456/L7n6KzrE_normal.jpg"
"13",1136457579754872832,1257831735733170176,"2020/05/06 00:37:09","KemperEliot","#Coronavirus VI: #Testing: Last Week #Tonight with #JohnOliver (HBO) https://t.co/hYuvTz5Nfk via @LastWeekTonight","Twitter for iPhone",113,NA,NA,NA,FALSE,FALSE,0,0,NA,NA,"Coronavirus, Testing, Tonight, JohnOliver",NA,"youtu.be/7rl4c-jr7g0","https://t.co/hYuvTz5Nfk","https://youtu.be/7rl4c-jr7g0",NA,NA,NA,NA,NA,NA,NA,NA,"2317351705","LastWeekTonight","en",NA,NA,NA,NA,NA,NA,NA,NA,NA,NA,NA,NA,NA,NA,NA,NA,NA,NA,NA,NA,NA,NA,NA,NA,NA,NA,NA,NA,NA,NA,NA,NA,NA,NA,NA,NA,NA,NA,NA,"https://twitter.com/KemperEliot/status/1257831735733170176","Eliot Kemper","Tempe, AZ","Sci/Tech Policy wonk. Real focused on existential risk mitigation. Trying to do the next right thing for the next right reason. Jobs in space governance. He/Him","https://t.co/vkxcH1lCxc",FALSE,313,2619,1,3629,15814,"2019/06/06 02:19:36",FALSE,"https://t.co/vkxcH1lCxc","https://www.youtube.com/user/ELIOTKEMPER/playlists",NA,"https://pbs.twimg.com/profile_banners/1136457579754872832/1560144403","http://abs.twimg.com/images/themes/theme1/bg.png","http://pbs.twimg.com/profile_images/1136457880314503169/EFgsmtCb_normal.png"
"14",1160255640,1257831679982333952,"2020/05/06 00:36:56","BarHomeJLB","@AlexBerenson @realDonaldTrump Now he just needs to admit that he was hoodwinked by his Covid task force.","Twitter for iPhone",74,1257795824135831552,87679233,"AlexBerenson",FALSE,FALSE,0,0,NA,NA,NA,NA,NA,NA,NA,NA,NA,NA,NA,NA,NA,NA,NA,"87679233, 25073877","AlexBerenson, realDonaldTrump","en",NA,NA,NA,NA,NA,NA,NA,NA,NA,NA,NA,NA,NA,NA,NA,NA,NA,NA,NA,NA,NA,NA,NA,NA,NA,NA,NA,NA,NA,NA,NA,NA,NA,NA,NA,NA,NA,NA,NA,"https://twitter.com/BarHomeJLB/status/1257831679982333953","Jon L Brown","Phoenix, AZ","Finance by day and make cocktails at night for friends and family.",NA,FALSE,34,162,0,177,272,"2013/02/08 14:10:55",FALSE,NA,NA,NA,"https://pbs.twimg.com/profile_banners/1160255640/1533084600","http://abs.twimg.com/images/themes/theme1/bg.png","http://pbs.twimg.com/profile_images/1024457176931217409/vQsLebSL_normal.jpg"
"15",829727858482245632,1257831605239832576,"2020/05/06 00:36:38","hacksmom12","Seeing Trump’s visit to Honeywell in Phoenix on my TV. No masks, no one staying 6 feet away from the next person, a breeding ground for COVID-19 if any of those people are asymptomatic and positive without knowing it.","Twitter for iPhone",217,NA,NA,NA,FALSE,FALSE,0,0,NA,NA,NA,NA,NA,NA,NA,NA,NA,NA,NA,NA,NA,NA,NA,NA,NA,"en",NA,NA,NA,NA,NA,NA,NA,NA,NA,NA,NA,NA,NA,NA,NA,NA,NA,NA,NA,NA,NA,NA,NA,NA,NA,NA,NA,NA,NA,NA,NA,NA,NA,NA,NA,NA,NA,NA,NA,"https://twitter.com/hacksmom12/status/1257831605239832577","GrammaSuzy","Arizona, USA","Working grandmother. Live in the desert. Love books and movies and family.",NA,FALSE,98,385,0,2069,13230,"2017/02/09 16:25:11",FALSE,NA,NA,NA,NA,NA,"http://pbs.twimg.com/profile_images/1100439876174897152/-wugeOAs_normal.jpg"
"16",14592723,1257831492190982144,"2020/05/06 00:36:11","MayoClinic","Recent reports of cats and dogs becoming infected with #SARSCoV2, the virus that causes #COVID19, has prompted the @CDCgov to update its guidelines for pets. @drgregpoland says health experts are still learning a lot about COVID-19. https://t.co/lFtdEx5szj https://t.co/kQZEJ8lYhy","Sprinklr",256,NA,NA,NA,FALSE,FALSE,4,5,NA,NA,"SARSCoV2, COVID19",NA,"mayocl.in/3aVZnA4","https://t.co/lFtdEx5szj","https://mayocl.in/3aVZnA4","http://pbs.twimg.com/media/EXS3E43WsAANkAa.jpg","https://t.co/kQZEJ8lYhy","https://twitter.com/MayoClinic/status/1257831492190982146/photo/1","photo","http://pbs.twimg.com/media/EXS3E43WsAANkAa.jpg","https://t.co/kQZEJ8lYhy","https://twitter.com/MayoClinic/status/1257831492190982146/photo/1",NA,"146569971, 65538097","CDCgov, drgregpoland","en",NA,NA,NA,NA,NA,NA,NA,NA,NA,NA,NA,NA,NA,NA,NA,NA,NA,NA,NA,NA,NA,NA,NA,NA,NA,NA,NA,NA,NA,NA,NA,NA,NA,NA,NA,NA,NA,NA,NA,"https://twitter.com/MayoClinic/status/1257831492190982146","Mayo Clinic","Minnesota, Florida, Arizona","An integrated clinical practice, education and research institution specializing in treating patients. Account maintained by @MayoClinic/MCSMN.","http://t.co/DbyMFcKS1R",FALSE,2001914,1791,12524,50778,3621,"2008/04/29 23:25:56",TRUE,"http://t.co/DbyMFcKS1R","http://mayocl.in/web",NA,"https://pbs.twimg.com/profile_banners/14592723/1564510850","http://abs.twimg.com/images/themes/theme1/bg.png","http://pbs.twimg.com/profile_images/1105095948571738112/ly_P2Irt_normal.png"
"17",14592723,1257814834512625664,"2020/05/05 23:30:00","MayoClinic","On the #MayoClinicQandA podcast, @GIcancerDoc, a Mayo Clinic oncologist, explains how cancer patients can safely continue their cancer treatment during the #COVID19 pandemic.
https://t.co/lq34vYUyYG","Sprinklr",198,NA,NA,NA,FALSE,FALSE,9,4,NA,NA,"MayoClinicQandA, COVID19",NA,"mayocl.in/3b9Sv2h","https://t.co/lq34vYUyYG","https://mayocl.in/3b9Sv2h",NA,NA,NA,NA,NA,NA,NA,NA,"4756413976","GIcancerDoc","en",NA,NA,NA,NA,NA,NA,NA,NA,NA,NA,NA,NA,NA,NA,NA,NA,NA,NA,NA,NA,NA,NA,NA,NA,NA,NA,NA,NA,NA,NA,NA,NA,NA,NA,NA,NA,NA,NA,NA,"https://twitter.com/MayoClinic/status/1257814834512625665","Mayo Clinic","Minnesota, Florida, Arizona","An integrated clinical practice, education and research institution specializing in treating patients. Account maintained by @MayoClinic/MCSMN.","http://t.co/DbyMFcKS1R",FALSE,2001914,1791,12524,50778,3621,"2008/04/29 23:25:56",TRUE,"http://t.co/DbyMFcKS1R","http://mayocl.in/web",NA,"https://pbs.twimg.com/profile_banners/14592723/1564510850","http://abs.twimg.com/images/themes/theme1/bg.png","http://pbs.twimg.com/profile_images/1105095948571738112/ly_P2Irt_normal.png"
"18",430459707,1257820924310458368,"2020/05/05 23:54:12","BranGoch","@PressSec @realDonaldTrump But #WhereAreTheTests 
We need at least 330 million, probably two or three times that, to deal with subsequent saves of coronavirus.","Twitter Web App",132,1257787627836772352,818927131883356160,"PressSec",FALSE,FALSE,0,0,NA,NA,"WhereAreTheTests",NA,NA,NA,NA,NA,NA,NA,NA,NA,NA,NA,NA,"818927131883356161, 25073877","PressSec, realDonaldTrump","en",NA,NA,NA,NA,NA,NA,NA,NA,NA,NA,NA,NA,NA,NA,NA,NA,NA,NA,NA,NA,NA,NA,NA,NA,NA,NA,NA,NA,NA,NA,NA,NA,NA,NA,NA,NA,NA,NA,NA,"https://twitter.com/BranGoch/status/1257820924310458370","ffransis ap ffransis","Sonoran Desert, AZ","Blocked by Dana Loesch of the NRA!
No DMs--I don't respond.
""Liberty and Justice FOR ALL.""--No exceptions.
True Leveller (look it up)
I block bigots and racists","https://t.co/tGSYpjvYIM",FALSE,2178,5003,132,117217,35404,"2011/12/07 06:00:27",FALSE,"https://t.co/tGSYpjvYIM","https://www.facebook.com/CloneJack/",NA,"https://pbs.twimg.com/profile_banners/430459707/1398360548","http://abs.twimg.com/images/themes/theme10/bg.gif","http://pbs.twimg.com/profile_images/1073416074928914432/6MpAYPVr_normal.jpg"
"19",430459707,1257831256101801984,"2020/05/06 00:35:15","BranGoch","Opinion | I'm a New York City Subway Conductor Who Had Covid-19 - The New York Times https://t.co/RQuL6T0hI0","SmartNews | スマートニュース",108,NA,NA,NA,FALSE,FALSE,0,0,NA,NA,NA,NA,"nytimes.com/2020/05/05/opi…","https://t.co/RQuL6T0hI0","https://www.nytimes.com/2020/05/05/opinion/coronavirus-nyc-subway.html#click=https://t.co/QR6aInhU2q",NA,NA,NA,NA,NA,NA,NA,NA,NA,NA,"en",NA,NA,NA,NA,NA,NA,NA,NA,NA,NA,NA,NA,NA,NA,NA,NA,NA,NA,NA,NA,NA,NA,NA,NA,NA,NA,NA,NA,NA,NA,NA,NA,NA,NA,NA,NA,NA,NA,NA,"https://twitter.com/BranGoch/status/1257831256101801984","ffransis ap ffransis","Sonoran Desert, AZ","Blocked by Dana Loesch of the NRA!
No DMs--I don't respond.
""Liberty and Justice FOR ALL.""--No exceptions.
True Leveller (look it up)
I block bigots and racists","https://t.co/tGSYpjvYIM",FALSE,2178,5003,132,117217,35404,"2011/12/07 06:00:27",FALSE,"https://t.co/tGSYpjvYIM","https://www.facebook.com/CloneJack/",NA,"https://pbs.twimg.com/profile_banners/430459707/1398360548","http://abs.twimg.com/images/themes/theme10/bg.gif","http://pbs.twimg.com/profile_images/1073416074928914432/6MpAYPVr_normal.jpg"
"20",430459707,1257820534156320768,"2020/05/05 23:52:39","BranGoch","New Poll: Majority Call Trump's Covid-19 Response 'Erratic' https://t.co/upj9FEBTMw
@realDonaldTrump","Twitter Web App",100,NA,NA,NA,FALSE,FALSE,0,0,NA,NA,NA,NA,"mediaite.com/politics/new-p…","https://t.co/upj9FEBTMw","https://www.mediaite.com/politics/new-poll-majority-of-americans-call-trumps-coronavirus-response-unprepared-and-erratic/",NA,NA,NA,NA,NA,NA,NA,NA,"25073877","realDonaldTrump","en",NA,NA,NA,NA,NA,NA,NA,NA,NA,NA,NA,NA,NA,NA,NA,NA,NA,NA,NA,NA,NA,NA,NA,NA,NA,NA,NA,NA,NA,NA,NA,NA,NA,NA,NA,NA,NA,NA,NA,"https://twitter.com/BranGoch/status/1257820534156320774","ffransis ap ffransis","Sonoran Desert, AZ","Blocked by Dana Loesch of the NRA!
No DMs--I don't respond.
""Liberty and Justice FOR ALL.""--No exceptions.
True Leveller (look it up)
I block bigots and racists","https://t.co/tGSYpjvYIM",FALSE,2178,5003,132,117217,35404,"2011/12/07 06:00:27",FALSE,"https://t.co/tGSYpjvYIM","https://www.facebook.com/CloneJack/",NA,"https://pbs.twimg.com/profile_banners/430459707/1398360548","http://abs.twimg.com/images/themes/theme10/bg.gif","http://pbs.twimg.com/profile_images/1073416074928914432/6MpAYPVr_normal.jpg"
"21",430459707,1257818505446952960,"2020/05/05 23:44:35","BranGoch","Trump officials ignored coronavirus warnings, ousted scientist says in whistleblower complaint https://t.co/IsXxnq8NEj","SmartNews | スマートニュース",118,NA,NA,NA,FALSE,FALSE,0,1,NA,NA,NA,NA,"latimes.com/politics/story…","https://t.co/IsXxnq8NEj","https://www.latimes.com/politics/story/2020-05-05/ousted-government-scientist-whistleblower-complaint",NA,NA,NA,NA,NA,NA,NA,NA,NA,NA,"en",NA,NA,NA,NA,NA,NA,NA,NA,NA,NA,NA,NA,NA,NA,NA,NA,NA,NA,NA,NA,NA,NA,NA,NA,NA,NA,NA,NA,NA,NA,NA,NA,NA,NA,NA,NA,NA,NA,NA,"https://twitter.com/BranGoch/status/1257818505446952962","ffransis ap ffransis","Sonoran Desert, AZ","Blocked by Dana Loesch of the NRA!
No DMs--I don't respond.
""Liberty and Justice FOR ALL.""--No exceptions.
True Leveller (look it up)
I block bigots and racists","https://t.co/tGSYpjvYIM",FALSE,2178,5003,132,117217,35404,"2011/12/07 06:00:27",FALSE,"https://t.co/tGSYpjvYIM","https://www.facebook.com/CloneJack/",NA,"https://pbs.twimg.com/profile_banners/430459707/1398360548","http://abs.twimg.com/images/themes/theme10/bg.gif","http://pbs.twimg.com/profile_images/1073416074928914432/6MpAYPVr_normal.jpg"
